file_name,QuestionText,answer
bird.wav,क्या पक्षी कॉल सुना जा सकता है?,हाँ
Remix of 101980__pyr0x__growl_variants.wav,क्या कीड़े हैं?,नहीं
1990 repetition brass-band 01.wav,क्या पीतल के वाद्ययंत्र बजाए जा रहे हैं?,हाँ
Stream Honiton.wav,क्या पक्षी चहक रहे हैं?,हाँ
chinesealarmclock.wav,क्या एक बच्चा हंस रहा है?,नहीं
Strong Wind through leaves.wav,क्या यह ध्वनि मौसम से संबंधित है?,हाँ
contact_floor_lamp.wav,क्या वस्तु धातु से बना है?,हाँ
Scribble_long_strokes.wav,क्या कोई सैंड पेपर के साथ सतह को चमका रहा है?,हाँ
"ATM-LES-CIST-1,50.wav",क्या कोई कुत्ता भौंक रहा है?,नहीं
Packaging Paper Pen Scribble.wav,क्या कोई कुछ कर रहा है?,हाँ
Dribbling water.wav,"पानी के चलने के बाद, क्या नल बंद हो गया है?",हाँ
Summer waves at Charmouth beach in Dorset.wav,क्या लहरें हैं?,हाँ
Rain Thunder - Copy.wav,क्या बारिश गिर रही है?,हाँ
just birds.wav,क्या एक से अधिक प्रकार के पक्षी गायन हैं?,हाँ
Dawn chorus - Makvaneti.wav,क्या कोई मुर्गा है?,हाँ
WinterWren1.wav,क्या कुत्ते भौंक रहे हैं?,नहीं
Turning on Shower 2_1-2.wav,क्या तरल जल्दी से बाहर आ रहा है?,हाँ
2009-07-17_1047_Mercado Bolhao between butcher&#39;s and beans.wav,क्या यह एक भीड़ भरे क्षेत्र है?,हाँ
in_the_train_to_montpellier.wav,क्या वे एक कॉन्सर्ट में हैं?,नहीं
SummerSwellingInsectsFerneCliff.wav,क्या कोई बोल रहा है?,नहीं
Suburban thunder 01 130620_00.wav,क्या चहक रहा है?,हाँ
affected_population.wav,क्या लोगों की भीड़ है?,हाँ
Synthetic Rain Noise.wav,क्या ध्वनि जोर से है?,नहीं
pages turning.wav,क्या पक्षियों को चहकते हुए सुना जा सकता है?,नहीं
Drawers opening and closing.wav,क्या कुछ फिसल रहा है?,हाँ
wastecollection.wav,क्या एक इंजन चल रहा है?,हाँ
Deltic Diesel Train Departure~Irwell Vale Halt~Bury.wav,क्या लोगों का एक समूह है?,हाँ
Sheep BAAAH.wav,क्या एक बकरी की आवाज है?,हाँ
am band static.wav,क्या यह एक कॉन्सर्ट में है?,हाँ
SYnth_NoisesAX9.wav,क्या ये ड्रम हैं?,नहीं
bm_lampshade.wav,क्या साधन एक से अधिक बार झंकार करता है?,हाँ
Microwave Door Open Close .wav,क्या ध्वनि असमान गति से हो रही है?,हाँ
gas cooker.wav,क्या यह बाहर है?,हाँ
Toilet paper (Roll off and tear).wav,क्या आदमी एक बॉक्स को सील करने के लिए टेप खींच रहा है?,हाँ
officeWaterPumpShort1.wav,क्या पास में तरल है?,हाँ
md1trk10.wav,क्या यह एक आरामदायक शोर है?,नहीं
Bathtub_with_Foam.wav,क्या एक अलार्म बंद हो जाता है?,नहीं
seagulls.wav,क्या जानवरों को पृष्ठभूमि में शोर कर रहे हैं?,हाँ
md1trk1.wav,क्या कोई फोन का जवाब देता है?,नहीं
070821_flsp_trail05.wav,क्या यह एक होटल के अंदर हो रहा है?,नहीं
Windstorm.wav,क्या ऑब्जेक्ट शोर को स्थिर कर रहा है?,हाँ
walking in snow 2.wav,क्या तत्व को क्रंचिंग पर चलाया जा रहा है?,हाँ
0401 Traffic_light_sound.wav,क्या कोई पक्षी चहक रहा है?,हाँ
Blackcap.wav,क्या एक से अधिक पक्षी शोर कर रहे हैं?,हाँ
EQUIP_expressoMaker_01.wav,क्या मोटर बाइक हमेशा निष्क्रिय में रहती है?,हाँ
cat_drinking.wav,क्या बारिश हो रही है?,नहीं
Grand Union Canal Kensal Green.wav,क्या यह ट्रैफ़िक है?,नहीं
gasp after a run.wav,क्या व्यक्ति पूरी क्लिप के दौरान सांस लेता है?,हाँ
Elevator sounds.wav,क्या मशीनरी चलती है?,हाँ
"VCR,rewind,opendoor.wav",क्या कोई लोग शांत रह रहे हैं?,हाँ
walking-gravel.wav,क्या व्यक्ति बजरी में चल रहा है?,हाँ
scraping seeds from a squash.wav,क्या कोई स्क्रैपिंग साउंड है?,हाँ
Car Driving.wav,क्या यह ध्वनि एक मानव निर्मित वस्तु द्वारा बनाई गई है?,हाँ
bathroomSink2.wav,क्या एक नल खुला और पानी चल रहा है?,हाँ
Rain Loop with Low-Cut Filter.wav,क्या यह बाहर है?,हाँ
walking down hall MIT mike closer to feet.wav,क्या एक कुत्ता पुताई है?,नहीं
Strong Wind through leaves.wav,क्या एक कार हॉर्न बीप करता है?,नहीं
Geese - Chatter 1 - 96kHz.wav,क्या जानवर पानी में हैं?,हाँ
Hatched.wav,क्या आसपास के जानवर हैं?,हाँ
Spring.wav,क्या बुदबुदाती है?,हाँ
nnus_forklift_driveby.wav,क्या यह वाहन दूर चला जाता है?,हाँ
Heavy rain and thunder in Oklahoma.wav,क्या अलग -अलग आवाज़ें आमतौर पर एक दूसरे के साथ जुड़ी हुई हैं?,हाँ
it_has_just_begun.wav,क्या पृष्ठभूमि में जोर से संगीत है?,नहीं
Kobe-train-announcement-and-arrival.wav,क्या आवाजें सुनी जा सकती हैं?,हाँ
Atmosphere - City Fountain (Loop).wav,क्या आसपास के लोग हैं?,हाँ
Toilet Flushaf.wav,क्या यह एक जंगल में है?,नहीं
little creek in the woods.wav,क्या बच्चे पृष्ठभूमि में रो रहे हैं?,नहीं
STE-005.wav,क्या ध्वनि जोर से और अशुभ है?,नहीं
Oven 01.wav,क्या यह एक मशीन है?,हाँ
fdv_machine_a_ecrire.wav,क्या व्यक्ति बहुत धीरे -धीरे टाइप कर रहा है?,नहीं
Glass pieces smashed.wav,क्या कोई सीटी बज रहा है?,नहीं
threejackhammers.wav,क्या क्लिकिंग दोहराव है?,हाँ
Pedestrian street cph.wav,क्या इंजन का स्पटरिंग बंद हो जाता है?,हाँ
Birds_and_Water_Filling_Rain_Barrel.wav,क्या यह एक एकल स्वर है?,नहीं
lungs.wav,क्या लोग बात कर रहे हैं?,नहीं
"a gentle breeze, wind 2.wav",क्या यह हवा की तरह लगता है?,हाँ
shopping-cart-rattle.wav,क्या कोई बिल्ली है?,नहीं
sants_train.wav,क्या शोर सुसंगत है?,हाँ
07_Lanes_Island_Ambient2_44_16.wav,क्या पक्षी एक दूसरे के साथ संवाद कर रहे हैं?,हाँ
The Big Circle.wav,क्या पक्षी चहक रहे हैं?,नहीं
FP_Flock_of_Birds.wav,क्या लोगों को बात करते हुए सुना जा सकता है?,नहीं
md10trk3.wav,क्या मशीन का शोर स्थिर है?,हाँ
wooden boat row water.wav,क्या कोई मोटर है?,नहीं
waves.wav,क्या कई लहरें हैं?,हाँ
birds forest.wav,क्या यह एक तम्बू के अंदर हो रहा है?,हाँ
Ambience - Generator.wav,क्या ध्वनि पूरे समय स्थिर रहती है?,हाँ
20080504.birdsong.wav,क्या कोई जोर से पानी पी रहा है?,नहीं
Shanghai Traffic Near Peoples Square.wav,क्या ध्वनि स्थिर है?,नहीं
Crepe Making.wav,क्या कुछ खाना बनाना है?,हाँ
Galactic signal 3.wav,क्या अलार्म साउंड में जल्दी क्लिक कर रहे हैं?,हाँ
ShowerAndSoap.wav,क्या शॉवर चल रहा है?,हाँ
Backyard Gate.wav,क्या एक गेट खुला है?,हाँ
froggies.wav,क्या ये जानवर एक मध्यम आकार के कुत्ते से बड़े हैं?,नहीं
Thainst12_AuctionPoultry.wav,क्या आसपास के लोग हैं?,हाँ
Tsaritsyno-Park. Spring.wav,क्या यह प्रकृति में है?,हाँ
Shanghai Traffic Near Peoples Square.wav,क्या ध्वनि तीव्रता में भिन्न होती है?,हाँ
"ATM-LES-CIST-1,50.wav",क्या पक्षी चहक रहे हैं?,हाँ
smoking in car.wav,क्या बात कर रहा था?,नहीं
120127_0000 train-interior-conversations.wav,क्या कई लोग बोल रहे हैं?,हाँ
Ravens.wav,क्या कोई व्यक्ति पियानो बज रहा है?,नहीं
Schnelllauferpresse 03.wav,क्या यह एक बाइक पर घंटी है?,नहीं
crickets and blimp.wav,क्या कोई इंजन ड्रोनिंग है?,हाँ
Show Opener - LiftOff.wav,क्या लोग बातचीत कर रहे हैं?,नहीं
Tallarol capnegre.wav,क्या कीट ध्वनि निरंतर है?,हाँ
auto5.wav,क्या कोई वाहन फिर से शुरू हो रहा है?,हाँ
glass (1).wav,क्या शोर को स्थिर किया जा रहा है?,हाँ
Geese1 - (Apollonia&#39;s sPA) 18.44 05.10.wav,क्या लोग बात कर रहे हैं?,नहीं
air show flyby 2007-08-18.wav,क्या वाहन करीब आता है तो दूर दूर चला जाता है?,हाँ
magazinedrop.wav,क्या आइटम का पैटर्न गिराया जा रहा है यादृच्छिक लग रहा है?,हाँ
wind-up.wav,क्या विंड-अप खिलौना काम करने में विफल रहा?,नहीं
Windy_Night_01.wav,क्या यह शुरुआत में शांत है?,हाँ
construction equipment tracked.wav,क्या रेडियो वाहन में खेल रहा है?,नहीं
alien glass birds.wav,क्या यह ध्वनि एक इलेक्ट्रॉनिक डिवाइस द्वारा बनाई गई है?,हाँ
tram_enoshima.wav,क्या एक कार इंजन सुना जा सकता है?,हाँ
coast wave kids far 160710_0914.wav,क्या जानवर शोर कर रहे हैं?,नहीं
releasing_water_into_sink_and_draining.wav,क्या कोई सिंक बेसिन भर रहा है?,हाँ
DePanne.wav,क्या पक्षी स्क्वाकिंग हैं?,नहीं
File clicking open.wav,क्या कुछ मारा जा रहा है?,हाँ
fulles_arroseguentse.wav,क्या कोई चल रहा है?,हाँ
birds_in_moms_garden.wav,क्या कारें अपने सींगों को बीप कर रही हैं?,नहीं
static 770 kHz cycle zap.wav,क्या किसी का फोन बजता है?,नहीं
sw_PoultryBarn_cs8049.wav,क्या लोगों का एक समूह है?,हाँ
Binding my thesis.wav,क्या कोई मशीन शोर कर रही है?,हाँ
Boom_Folie_PlayingWithCurtains.wav,क्या कार अलार्म बंद हो रहा है?,नहीं
India Streets Bangalore City (Tuktuk Ride).wav,क्या एक महिला कभी बोल रही है?,हाँ
stream5.wav,क्या यह एक कार है?,नहीं
Ahr river.wav,क्या पानी लगातार गिर रहा है?,हाँ
buzzing stinging.wav,क्या पृष्ठभूमि में कीड़ों को सुना जा सकता है?,हाँ
Kids chatter Primary School Birmingham UK.wav,क्या लोग एक गीत गा रहे हैं?,नहीं
Schnelllauferpresse 01.wav,क्या एक मशीन द्वारा पाउंडिंग बनाई जा रही है?,हाँ
ResidentialFallNight_crickets.wav,क्या यह बाहर है?,हाँ
inside a japanese bus.wav,क्या एक जानवर कचरा में हो रहा है?,नहीं
Jr High Hallway Front.wav,क्या कई लोग बात कर रहे हैं?,हाँ
Mechanical camera sound.wav,क्या कई क्रियाएं हो रही हैं?,हाँ
md1trk1.wav,क्या कोई गेंद को उछाल रहा है?,नहीं
STE-003_thunder_rain.wav,क्या कोई तैर रहा है?,नहीं
Remote highway atmosphere.wav,क्या पक्षी चहक रहे हैं?,हाँ
Rope tied to boat in port.wav,क्या दरवाजा एक जोरदार क्रैकिंग शोर करता है?,हाँ
barrelhits.wav,क्या ऑब्जेक्ट हिलाता और वाइब्रेट करता है क्या पतला लगता है?,हाँ
Int. Car Drive 1.wav,क्या लोग चैट कर रहे हैं?,नहीं
fs_brokenMixer302-2.wav,क्या कोई हिसिंग है?,हाँ
md1trk38.wav,क्या व्यक्ति को सुरक्षा उपकरण की आवश्यकता है?,हाँ
2009-07-17_1047_Mercado Bolhao between butcher&#39;s and beans.wav,क्या कोई जोर से वाहन हैं?,नहीं
Street Seller in Mexico City. Tights for girls.wav,क्या महिलाएं मौजूद हैं?,नहीं
urinal.wav,क्या कोई नाली है?,हाँ
airport_ambiance_01.wav,क्या लोग हंस रहे हैं?,हाँ
amolador_pan_pipe.wav,क्या कार चला रहे हैं?,हाँ
Seashore Atmos LW2.wav,क्या मोटर आरपीएम में अंत की ओर बढ़ता है?,हाँ
20090102.street.noise.wav,क्या सायरन उस व्यक्ति से दूर जा रहा है?,हाँ
Noisy Hotel Bathroom Fan (starts + stops).wav,जब ऑब्जेक्ट बंद हो जाता है तो क्या शोर बंद हो जाता है?,हाँ
White River birds 2.wav,क्या कोई पक्षी शोर कर रहा है?,हाँ
Class 66 At Aliwal Lane Crossing Whittlesea.wav,क्या यह एक अच्छी शांत सेटिंग घर के अंदर है?,नहीं
20091225.rain.01.wav,क्या पानी का फव्वारा है?,नहीं
Playing With Tin Foil.wav,क्या कुछ खोला जा रहा है?,हाँ
Street Seller in Mexico City. Tights for girls.wav,क्या केवल एक ही आवाज बोल रही है?,हाँ
trail_footsteps_2_0725_102951.wav,क्या व्यक्ति के पास स्क्वीकी जूते हैं?,हाँ
Walking_up_the_hill.wav,एक भेड़िया हाउलिंग है?,नहीं
stream_small.wav,क्या बादलों से पानी गिर रहा है?,हाँ
"October night, cicadas, crickets, jet flyover.wav",क्या कोई फर्श पर झाड़ू लगा रहा है?,नहीं
drive by moped.wav,क्या यह ध्वनि एक विमान है?,हाँ
Eyelit cabinet.wav,क्या ध्वनि कंप्यूटर उत्पन्न होता है?,नहीं
nnus_forklift_driveby.wav,क्या इंजन को पुनर्जीवित किया जा रहा है?,हाँ
T12_Huber_Walking on Gravel.wav,क्या व्यक्ति सामान्य गति से चल रहा है?,हाँ
wood desk Open and close.wav,क्या एक्शन दोहराव है?,हाँ
Toilet Flushaf.wav,क्या बच्चे चिल्ला रहे हैं?,नहीं
01 barreau bunker original.wav,क्या टोन में रिंग अलग है?,हाँ
La cuina del institut.wav,क्या बड़े जानवर घास के माध्यम से चल रहे हैं?,नहीं
Galactic signal 3.wav,क्या कोई छींक रहा है?,नहीं
birds_long.wav,क्या जानवर एक दूसरे पर हमला कर रहे हैं?,नहीं
Spaceship background ambience.wav,क्या क्लिप ज्यादातर चुप है?,हाँ
chicken.wav,क्या यह एक डिनर के अंदर है?,नहीं
Rain Aluminium Roof.wav,क्या यह कागज का एक टुकड़ा है?,नहीं
"India Divali Celebration Night (Fireworks, Voices, Traffic).wav",क्या कुछ शानदार हो रहा है?,हाँ
CoinSpin.wav,क्या कोई चबाना है?,नहीं
inside a japanese bus.wav,क्या वाहन दूर है?,हाँ
Knocking at door.wav,एक चेनसॉ का उपयोग किया जाता है?,नहीं
Echo Garage Door.wav,क्या शोर जोर से हो जाता है तो नरम हो जाता है?,हाँ
wiping_wet_paper.wav,क्या व्यक्ति ध्वनि को बेहोश कर रहा है?,नहीं
2006_04_16_water_and_frogs_colliure.wav,क्या वह मामला जो तरल अवस्था में ध्वनि पैदा करता है?,हाँ
steam radiator.wav,क्या यह एक जल निकासी तंत्र है?,हाँ
Walking on snow frozen to ice.wav,क्या व्यक्ति करीब हो रहा है?,हाँ
20130406_tourists.06.wav,क्या बोलने को जीवंत रूप से चित्रित किया जा सकता है?,हाँ
casino_ambiance_03.wav,क्या पक्षी अंदर चहक रहे हैं?,नहीं
threejackhammers.wav,क्या कई बच्चे खेल रहे हैं?,नहीं
Pas sur le sol.wav,क्या सतह सूखी है?,हाँ
kijjaz - Swimming Pool Pump 03.wav,क्या शोर पूरे क्लिप में एक ही पिच के साथ समान रहता है?,हाँ
Industrial Heating Vent.wav,क्या लोग बात कर रहे हैं?,नहीं
KOOKABURRA..WAV.wav,क्या केवल पक्षियों को सुना जाता है?,नहीं
threejackhammers.wav,क्या कोई लड़का चिल्ला रहा है?,नहीं
Hydrophone_Newport Footbridge Fountains 06.wav,क्या लहरें धो रही हैं?,हाँ
windy_driving.wav,क्या आज किसी को अपनी टोपी पर पकड़ रखने की आवश्यकता होगी?,हाँ
passenger train bells.wav,क्या घंटी जोर से बज रही है?,हाँ
Deltic Diesel Train Departure~Irwell Vale Halt~Bury.wav,क्या एक सीटी उड़ा है?,हाँ
drive by moped.wav,क्या लोग बात कर रहे हैं?,नहीं
metal clink.wav,क्या कोई वस्तुओं के माध्यम से बह रहा है?,हाँ
WasherEndofSpinCycleStartFillCycle.wav,क्या संगीत बजाया जा रहा है?,नहीं
shaking and opening a water bottle.wav,क्या यह बाहर गीला है?,हाँ
BANISTER_FLOOR CREAK.wav,क्या एक महिला बोल रही है?,नहीं
SYnth_NoisesAV.wav,क्या ध्वनि कभी बीच में रुकती है?,नहीं
writing_with_bold_marker (miroslawski.net).wav,क्या कोई लिख रहा है?,हाँ
Cat Eating Wet Food (Purring at start but not throughout).wav,क्या कुत्ता एक ही समय में खाना और पी रहा है?,हाँ
Water Splash 01.wav,क्या दूरी में गड़गड़ाहट है?,हाँ
CamelTalk.wav,क्या जानवरों की आवाज़ के बीच एक विराम है?,हाँ
RainGutter.wav,क्या लोगों को लड़ते हुए सुना जा सकता है?,नहीं
Oystercatchers and Chic.wav,क्या कोई कार है?,नहीं
souffle_me_tallique.wav,क्या कोई गा रहा है?,नहीं
tiny raindrops under an umbrella.wav,क्या कुछ जल रहा है?,हाँ
Remix of 101674__Robinhood76__01906_aluminium_foil_&#39;space-alien radio-static remix&#39;.wav,क्या स्थैतिक की ध्वनि युद्ध है?,हाँ
Tree Rustle 4.wav,क्या यह किसी के घर के अंदर है?,नहीं
birds_stereo.wav,क्या आवाज़ स्वाभाविक हैं?,हाँ
CONTACT MIC BOILING WATER 01.wav,क्या भीड़ के यातायात को सुना जा सकता है?,हाँ
froggies.wav,क्या ये जानवर बाहर हैं?,हाँ
Cityscape 02 090617.wav,क्या एक कार ड्राइविंग है?,हाँ
SparklingSound.wav,क्या यह बाहर हो रहा है?,हाँ
Garden ambience.wav,क्या एक से अधिक ध्वनि है?,हाँ
wooden boat row water.wav,क्या पानी में कोई नाव है?,हाँ
Packaging Paper Pen Scribble.wav,क्या कोई लिख रहा है या ड्राइंग है?,हाँ
Highway Ambience.wav,क्या एक कार ड्राइविंग कर रही है?,हाँ
Growling and Barking Dog.wav,क्या जानवर कभी -कभी भौंकने से पहले बढ़ता है?,हाँ
birds at dawn of spring.wav,क्या राजमार्ग शोर हैं?,हाँ
d0_drips_03.wav,क्या लोग एक दूसरे से बात कर रहे हैं?,नहीं
OrchestraTuning1.wav,क्या संगीत बजाया जा रहा है?,हाँ
Tree Rustle 4.wav,क्या लोग बात कर रहे हैं?,नहीं
120127_0000 train-interior-conversations.wav,क्या लोग बात कर रहे हैं?,हाँ
