file_name,QuestionText,answer
Suburban Ambience_1-2.wav,क्या कार के सींग हैं?,नहीं
Forbidden Purr01.wav,क्या व्यक्ति खांसी करता है?,नहीं
FlushToilet.wav,क्या एक शौचालय फ्लश किया गया है?,हाँ
"Wind, Soft. Crickets.wav",क्या आवाज है?,नहीं
Walking in Circles around fountain.wav,क्या रिकॉर्डिंग बाहर की गई थी?,हाँ
"Rain on awning, canopy.wav",क्या बारिश हो रही है?,हाँ
Washing Hands.wav,क्या पानी बंद हो जाता है?,नहीं
Slowly Walking Downhill on Dry Leaves.wav,क्या यह बाहर हो रहा है?,हाँ
indoors house ambient more silent room tone.wav,क्या कोई बच्चा मौजूद है?,हाँ
water plops.wav,क्या पानी पूरे समय टपकता है?,हाँ
Rain hitting leafs.wav,क्या यह ध्वनि पानी से आती है?,हाँ
immersion in a bath and getting out of the bath.wav,वहाँ छप है?,हाँ
rain_near_city_far.wav,क्या पानी जमीन पर प्रहार कर रहा है?,हाँ
20061205.washing.machine.wash.wav,क्या कई लोग पृष्ठभूमि में बात कर रहे हैं?,नहीं
STE-014-lisbonfountain01.wav,क्या कोई व्यक्ति आहें भरता है?,नहीं
Half bathroom with some toilet noise.wav,क्या हवा की दौड़ लगती है और फिर से शुरू होती है?,नहीं
Ambience - General Farm - 96kHz.wav,क्या लोग गा रहे हैं?,नहीं
Water Streaming #5.wav,क्या कोई एक गिलास पानी पी रहा है?,नहीं
bangalore_zug_steht.wav,क्या मशीन कितनी ज़ोर से बदलाव के बिना स्थिर रहती है?,हाँ
Toilet Flushaf.wav,क्या रिकॉर्डिंग में वस्तु गीली है?,हाँ
In Car Driving with Open Window.wav,क्या कुछ जमीन पर गिर गया और टूट गया?,नहीं
birds at dawn of spring.wav,क्या उनके उल्लू हूटिंग कर रहे हैं?,नहीं
Galaktisk time signal.wav,क्या यह संगीत की तरह लग रहा है?,हाँ
foot_steps_snow_02.wav,क्या किसी को चलते हुए सुना जा सकता है?,हाँ
Burco Conveyer Toaster running.wav,क्या मशीन एक डरावना शोर कर रही है?,हाँ
Tortured Apple 03.wav,क्या स्क्विशिंग साउंड वॉल्यूम में नरम हो रही है?,हाँ
Snow effects.wav,क्या कोई बाहर घूम रहा है?,हाँ
raindrops_metalcover.wav,क्या यह औद्योगिक शोर है?,हाँ
BsAS_Tren01.wav,क्या बज रहा है?,हाँ
trenecito_maqueta.wav,क्या दोहरावदार ध्वनि अंत में धीमी हो जाती है?,हाँ
Synthetic Rain Noise.wav,क्या ध्वनि क्रैकिंग है?,हाँ
1990 repetition brass-band 01.wav,क्या एक फायर ट्रक गुजरता था?,नहीं
"Marratxi_Melding_1e trein van spoor 2_is met bestemming_Palmamelding, dat trein op alle tussengelegen stations zal stoppen_100311.wav",क्या घोषणा एक स्वर से पहले है?,हाँ
FP_Drainage_System_Water_Drip.wav,क्या कुत्ते कमरे में हैं?,नहीं
Oven Door.wav,क्या धातु ज्यादातर शोर कर रही है?,हाँ
lungs.wav,क्या यह ध्वनि किसी प्रकार की मशीन द्वारा बनाई गई है?,हाँ
Synthetic Rain Noise.wav,क्या स्थिर है?,हाँ
Burleson01.wav,क्या वह व्यक्ति अभी भी खड़ा था?,नहीं
Knocking at door.wav,क्या वे एक बड़े ऑर्केस्ट्रा का हिस्सा हैं?,नहीं
Slowly Walking Downhill on Dry Leaves.wav,क्या वे हॉकी खेल रहे हैं?,नहीं
sultanahmet square.wav,क्या लोग बात कर रहे हैं?,हाँ
"a gentle breeze, wind 2.wav",क्या बारिश हो रही है?,नहीं
hugeSlidingDoorSlamSM57.wav,क्या कोई घूम रहा है?,हाँ
CarFerrySeaDogsPeople.wav,क्या केवल शुरुआत में बार्किंग सुना जाता है?,हाँ
"a gentle breeze, wind 2.wav",क्या कोई जानवर हैं?,नहीं
wood1.wav,क्या रेडियो चालू है?,नहीं
High pitched drilling.wav,क्या वह एक हथौड़ा का उपयोग कर रहा है?,नहीं
shufflingdirt.L.wav,क्या क्रंचिंग की आवाज़ सुनी जा सकती है?,हाँ
wind-up toy.wav,क्या लोगों की आवाज़ों की आवाज़ है?,नहीं
open and close umbrella.wav,क्या किसी व्यक्ति को किसी वस्तु को संभालने वाले व्यक्ति द्वारा ध्वनि बनाई जा रही है?,हाँ
cars_pass_01_070812.wav,क्या जानवर शोर कर रहे हैं?,नहीं
door-knock-open-close-wooden_close.wav,क्या दस्तक धीरे -धीरे अधिक तीव्र हो जाती है?,हाँ
Rattly metal elevator [binaural recording].wav,क्या कोई जानवर शोर कर रहा है?,नहीं
Snapping twig.wav,क्या यह लगता है कि किसी वस्तु को तोड़ा जा रहा है?,नहीं
Water Pour.wav,क्या खुले नल से पानी लगातार चल रहा है?,हाँ
Gym&#39;sHall.wav,क्या कोई जानवर मौजूद हैं?,नहीं
rollingthunder01.wav,क्या Hissing ध्वनि की संभावना वर्षा है?,हाँ
Atmo Wartehalle2.wav,क्या समय आगे बढ़ने के साथ कोई ताली बजाता है?,हाँ
officeWaterPumpShort1.wav,क्या कोई पूल में छप रहा है?,हाँ
"Neighbours saturday moning street activity, GREENFIELD PLACE (Snippet).wav",क्या ध्वनि में कोई बच्चे हैं?,हाँ
Fly_versus_Lamp.wav,क्या एक सतह में टकराया जा रहा है?,हाँ
Quiet Mood.wav,क्या एक पियानो बज रहा है?,हाँ
Traffic 1 Bikes &amp; cars.wav,क्या यह बाहर हो रहा है?,हाँ
Centurion Suburb Night.wav,क्या बारिश हो रही है?,हाँ
Prep Rally.wav,क्या एक रेडियो पर संगीत है?,हाँ
PageFlip5.wav,क्या एक आदमी खिड़की क्लीनर बेच रहा है?,नहीं
birmingham-aston-canal-extractor-fan-background.wav,क्या ट्रैफिक साउंड पूरे समय स्थिर रहता है?,हाँ
Pencil 1.wav,क्या टैपिंग है?,हाँ
Remix #3  of 30938__halleck__crash1-reverse.wav,क्या कोई बच्चा पृष्ठभूमि में हंस रहा है?,नहीं
KOOKABURRA..WAV.wav,क्या उष्णकटिबंधीय जानवर हैं?,हाँ
Village Morning Atmos.wav,क्या लोग बात कर रहे हैं?,नहीं
20160302_04.ushuaia.train.wav,क्या तीव्रता में ध्वनि में उतार -चढ़ाव होता है?,हाँ
Concrete Stairs.wav,क्या संगीत लय स्थापित कर रहा है?,नहीं
Rio Cadi.wav,क्या टूटे हुए पाइप से पानी का छिड़काव है?,हाँ
dripping taps.wav,क्या एक बच्चा गिड़गिड़ा रहा है?,नहीं
"swimming pool, night, street in background.wav",क्या सूरज चमक रहा है?,नहीं
cannons from Kronborg castle.wav,क्या लोग एक इनडोर स्थान पर हैं?,हाँ
wind-up toy.wav,क्या कोई मशीन चल रही है?,हाँ
creaking train.wav,क्या यह एक व्यक्ति है?,नहीं
my kitchen sink talks to me.wav,क्या कोई फुसफुसा रहा है?,नहीं
Street_Sounds_Night.wav,क्या किसी ने खांसी की?,हाँ
Lekkers Ambience.wav,क्या कोई वाहन है?,हाँ
20100307.subway.train.wav,क्या एक मोटर चल रही है?,हाँ
Singing Birds.wav,क्या कई पक्षी गा रहे हैं?,हाँ
west ham bubbles.wav,क्या संगीत गीत के साथ है?,नहीं
noisy street.wav,क्या यह ध्वनि कारों और ट्रकों के साथ एक सड़क की तरह है?,हाँ
Opening and closing DVD case.wav,क्या कुछ भारी गिर रहा है?,नहीं
Mechanical camera sound.wav,क्या ध्वनि दोहरा रही है?,हाँ
Tiny bells.wav,क्या ध्वनि किसी एकल वस्तु द्वारा निर्मित है?,हाँ
Car interior driving 1.wav,क्या यह जोर से है?,नहीं
Relaxing stream underwater SHORT 141015_0442.wav,क्या पानी का एक स्थिर प्रवाह है?,हाँ
shoreline_waves_seagulls.wav,क्या यह बाहर है?,हाँ
Spring Rain 1.wav,क्या कोई बड़ा तूफान है?,नहीं
"WASHING,machine.wav",क्या शोर का स्तर स्थिर है?,नहीं
0346 Traffic_at_Sindang.wav,क्या बहुत सारी बातें हैं?,नहीं
birds_serres_Auteuil.wav,क्या वे पक्षी उड़ रहे हैं?,हाँ
open and close umbrella.wav,क्या कोई व्यक्ति खुद से बात कर रहा है?,नहीं
20061208.waves.02.wav,क्या कोई मोटरबोट है?,नहीं
nnus_forklift_driveby.wav,क्या कोई मोटर है?,हाँ
SFX- Lavadora Vieja - Hector Bakero.wav,क्या ध्वनि एक जानवर से आ रही है?,हाँ
air show flyby 2007-08-18.wav,क्या बच्चा रो रहा है?,नहीं
Morgens 01.wav,क्या कुछ पक्षी दूसरों की तुलना में करीब हैं?,हाँ
Nightingale_near_street.wav,क्या प्रकृति की आवाज़ प्रचलित है?,हाँ
Sheet metal shake and drag.wav,क्या कुछ धातु है?,हाँ
inside a japanese bus.wav,क्या कोई अपने सींग पर लेटा रहा है?,नहीं
Strong Wind through leaves.wav,क्या एक मशीन यह शोर कर रही है?,नहीं
Rolling Drawer.wav,क्या दराज की आवाज़ खोली जा रही है और तीव्रता में बंद वृद्धि है?,हाँ
Dawn chorus - Makvaneti.wav,क्या जानवर एक घर के अंदर हैं?,नहीं
Prep Rally.wav,क्या संगीत बज रहा है?,हाँ
Tortured Apple 03.wav,क्या पदार्थ चिपचिपा है?,हाँ
Footdrags Dirt.wav,क्या कोई आगे बढ़ रहा है?,हाँ
alien glass birds.wav,क्या यह ध्वनि अप्राकृतिक है?,हाँ
market2.wav,क्या मनुष्य बात कर रहे हैं?,हाँ
birds-vendicari.wav,क्या पूरे क्लिप में भी पक्षी की लाउडनेस कॉल करती है?,नहीं
Plastic Drawer Open and Close.wav,क्या यह अंत में शांत हो जाता है?,नहीं
Rain Loop with Low-Cut Filter.wav,क्या कोई बवंडर चेतावनी है?,नहीं
120720loudestthunder.wav,क्या यह बाहर है?,हाँ
Fan_Ventilation_Stereo 2.wav,क्या यहाँ जानवर हैं?,नहीं
the sound of a forest after rain _ drops falling on ferns rear.wav,क्या केवल एक पक्षी है?,नहीं
Grand Prix 2.wav,क्या लोग चिल्ला रहे हैं?,नहीं
Wind-sea 03-091007.wav,क्या ध्वनि एक ट्रक से आती है?,हाँ
"Garbage truck, celaring glasscontainer.wav",क्या कोई गंभीर ध्वनि है?,हाँ
Air condition running.wav,क्या ध्वनि सुसंगत है?,हाँ
20061215.early.morning.wav,क्या एक घरेलू जानवर को सुना जा सकता है?,हाँ
20140809_cruzul.river.wav,क्या जल प्रवाह स्थिर है?,हाँ
20071229.cooing.wav,क्या पक्षी के अलावा अन्य आवाज़ें हैं?,हाँ
sawing asphalt.wav,क्या कोई जानवर मौजूद हैं?,नहीं
VULCANIZED_SOLE_FOOTSTEPS_MANOLIOM.wav,क्या वक्ता पुरुष है?,हाँ
Birds_and_Water_Filling_Rain_Barrel.wav,क्या यह मफल है?,हाँ
Rain 04 091012.wav,क्या यह एक अच्छा दिन है जो एक छाता के साथ है?,हाँ
SYnth_NoisesAV.wav,क्या ध्वनि बदल जाती है?,हाँ
"Budolfi Cathedral, Aalborg, DK, 1900hrs.wav",क्या लोग सड़क के पास हैं?,हाँ
Stepping in puddles w ambient rain.wav,क्या यह पानी है?,हाँ
Before-after remix of 117041__joedeshon__keys_in_ignition_warning.wav,क्या यह एक पुलिस सायरन की आवाज हो सकती है?,नहीं
20080504.birdsong.wav,क्या एक पक्षी जोर से सीटी बज रहा है?,हाँ
Light Rain Home2.wav,क्या कोई चट्टानों को फेंक रहा है?,नहीं
Long Fuzz.wav,क्या यह ध्वनि रुकती है और बार -बार शुरू होती है?,हाँ
Fergus Whining.wav,क्या यह एक पालतू जानवर है?,हाँ
SamyeLing_Drain121102.wav,क्या तरल टपकने से सुना जा सकता है?,हाँ
Exterior Prius In Stop Away series w door open and beeps at head.wav,क्या वाहन चलता है?,हाँ
Remix of 101980__pyr0x__growl_variants.wav,क्या बढ़ता है?,हाँ
Prep Rally.wav,क्या संगीत बहुत धीरे से बज रहा है?,नहीं
20110121_cranes.wind.wav,क्या कोई व्यक्ति चिल्ला रहा है?,नहीं
20061214.wrench.02.wav,क्या कोई कुछ कर रहा है?,हाँ
Newark airport outside.wav,क्या किसी का भाषण एक मशीन द्वारा प्रवर्धित है?,हाँ
"Weight machine, gas resistance.wav",क्या कोई गुलजार है?,हाँ
water.wav,क्या कोई पानी में छप रहा है?,नहीं
04-Bakken_GamblingMachines_Hall.wav,क्या लोगों के कई आयु समूहों को सुना जा सकता है?,हाँ
soda in ice.wav,क्या पृष्ठभूमि में एक टीवी खेल रहा है?,नहीं
Crickets indoors.wav,क्या कोई पानी टपकता है?,नहीं
engine start BMW 320 VG91.wav,क्या किसी ने इंजन शुरू किया?,हाँ
scraping seeds from a squash.wav,क्या कोई शॉवर ले रहा है?,नहीं
Jr High Hallway Front.wav,क्या बच्चे मौजूद हैं?,हाँ
Paging through book.wav,क्या एक पुस्तक के पृष्ठ मोड़ रहे हैं?,हाँ
Footsteps_Squeeky_Wood.wav,क्या स्क्वीक्स हैं?,हाँ
SamyeLing_Drain121102.wav,क्या आसपास कोई तरल है?,हाँ
0804_094043 metal grinding or drilling 30secs.wav,क्या कोई छटपटाता है?,नहीं
stream_small.wav,क्या यह एक वन नदी में है?,हाँ
little creek in the woods.wav,क्या तरल स्थिर गति से आगे बढ़ रहा है?,हाँ
kettle boiling on gas stove.wav,क्या मौसम गीला है?,हाँ
Movements in the Water.wav,क्या यह कार शुरू होने की आवाज है?,नहीं
Diesel train arrives and departs 2.wav,क्या सम्मान है?,नहीं
birds_oldmen_cafe.wav,क्या पानी छपाया जा रहा है?,नहीं
Thunder Sirens Wind and Rain.wav,क्या कोई आदमी बात कर रहा है?,नहीं
STE-018_lisbonbirds.wav,क्या कई पक्षी हैं?,हाँ
"India Divali Celebration Night (Fireworks, Voices, Traffic).wav",क्या क्षेत्र शांत है?,नहीं
Pig - Multiple Snorts 6 (2 pigs) - 96kHz.wav,क्या एक ट्रक सड़क के नीचे चला रहा है?,नहीं
noisy street.wav,क्या लोगों को बोलते हुए सुना जा सकता है?,नहीं
Feria.wav,क्या केवल वयस्क मौजूद हैं?,नहीं
Washing Hands.wav,क्या यहाँ तरल है?,हाँ
SFX_CHEERS-Bottle-CLANK_Beer-n-Wine.wav,क्या वह नाराज है?,नहीं
gentle village sounds ed 1f.wav,क्या एक आदमी एक बच्चे से बात करता है?,हाँ
trail_footsteps_2_0725_102951.wav,क्या संगीत बजाया जा रहा है?,नहीं
wind-noise.wav,क्या ध्वनि बंद हो जाती है?,नहीं
Morgens 04.wav,क्या पक्षी चहक रहे हैं?,हाँ
Pluja al 4L.wav,क्या बारिश हो रही है?,हाँ
uguisbari.wav,क्या पैदल चलने के दौरान पिंजरे चीखता है?,हाँ
Printer Setting Up.wav,क्या एक उल्लू हूटिंग है?,नहीं
Relaxing stream underwater SHORT 141015_0442.wav,क्या शिशुओं का एक स्थिर रो रहा है?,नहीं
GarbageTruck.wav,क्या कोई उपयोगिता वाहन रिवर्स में जा रहा है?,हाँ
around the yellow Ferrari pt. 1.wav,क्या यह एक सड़क के पास है?,हाँ
SwansFlyBy.wav,क्या यह अंदर है?,नहीं
20100418.marshes.storm.01.wav,क्या जानवर अंदर हैं?,नहीं
WaterSounds.wav,क्या ध्वनि लगातार बढ़ रही है?,नहीं
Rainstorm.wav,क्या सीगल को सुना जा सकता है?,हाँ
gas cooker.wav,क्या कुछ प्रज्वलित करता है?,हाँ
immersion in a bath and getting out of the bath.wav,क्या कोई रो रहा है?,नहीं
Untitled-13.wav,क्या इसमें एक राग है?,हाँ
Thick liquid bubble 2.wav,क्या शुरुआत में ध्वनि सबसे जोर से है?,नहीं
INT Bedroom tone 4 with bird.wav,क्या ध्वनि बाहर से आ रही है?,हाँ
Splashing Water in Bathtube_1-2.wav,क्या कोई बर्तन और धूपदान धो रहा है?,हाँ
hereg_hungary__grain_field_1_20080712.wav,क्या कीड़ों को सुना जा सकता है?,हाँ
"train at crossing, camden arkansas.wav",क्या यह सार्वजनिक परिवहन का एक रूप है?,हाँ
RBH_Household_Bathroom fan.wav,क्या एक मोटर चल रही है?,हाँ
San Simeon Beach at Midnight 1.wav,क्या पानी है?,हाँ
20060426.marsh.house.ambiance.wav,क्या लोगों की भीड़ है?,नहीं
Ambient_Winter.wav,क्या कोई सब्जियों को काट रहा है?,नहीं
Cat and Rain.wav,क्या आसपास कोई जानवर है?,हाँ
Boom_Folie_PlayingWithCurtains.wav,क्या धातु एक साथ स्क्रैप कर रही है?,हाँ
Spring.wav,क्या घास के माध्यम से कुछ फिसल रहा है?,नहीं
GulfWaves2.wav,क्या एक नदी पास में बह रही है?,हाँ
marche1.wav,क्या आंदोलन शामिल है?,हाँ
Outside01.wav,क्या कई लोगों को सुना जा सकता है?,नहीं
shaking and opening a water bottle.wav,क्या कोई तूफान है?,हाँ
Spanish pinball machine in bar.wav,क्या लोग बात कर रहे हैं?,हाँ
water puddle.wav,क्या कोई रो रहा है?,नहीं
in Park.wav,क्या क्षेत्र में लोग हैं?,हाँ
Backyard Gate.wav,क्या गेट चरमरा रहा है?,हाँ
Train Passby Right to Left with Horn Short 02.wav,क्या वह ट्रेन आ रही है?,हाँ
Clock.Windup.Bell.Antique.wav,एक अलार्म बजता है?,हाँ
"ATM-LES-CIST-1,50.wav",क्या कोई व्यक्ति बोल रहा है?,नहीं
Marker on Board.wav,क्या लेखन कभी विराम देता है?,हाँ
passenger train bells.wav,क्या कोई घंटी है?,हाँ
Opening and closing DVD case.wav,क्या कुछ एक से अधिक बार हिट है?,हाँ
tram_bell_ride_door.wav,क्या यह समुद्र तट पर है?,नहीं
Printing Press 4.wav,क्या यह एक मानव निर्मित वस्तु है?,हाँ
Rain on Window.wav,क्या ध्वनि अधिक शांत हो जाती है?,नहीं
20111208_beauty.and.3.beasts.wav,क्या यह एक घर के अंदर है?,नहीं
Shower and walk - front.wav,क्या सूर्य तन पाने के लिए यह एक अच्छा दिन है?,नहीं
Birds Chirping ME.A1.wav,क्या यह एक वाहन है?,नहीं
freezer hum.wav,क्या कुछ चालू है?,हाँ
crackling-rain-fire.wav,क्या वही ध्वनि पूरे समय बनाती है?,हाँ
ww big windchimes  fs  1 4 2011.wav,क्या कोई पियानो बज रहा है?,नहीं
Plane flying above.wav,क्या पृष्ठभूमि में बच्चा है?,हाँ
Clinking Glasses.wav,क्या ध्वनि एक क्लिंक है?,हाँ
Shipwreck underwater 01.wav,क्या कोई महिला चिल्ला रही है?,नहीं
Backhoe.wav,क्या मशीनरी से ध्वनि स्थिर थी?,हाँ
